{
  "$schema": "../../.claude-plugin/plugin-schema.json",
  "name": "design_pdf",
  "display": "PDF 생성·양식·서명·암호화 (mcp_docs 는 파싱만)",
  "prefix": "design_",
  "version": "0.2",
  "status": "spec-only",
  "phase": 2,
  "commands": "commands/",
  "skills": "skills/",
  "dependencies": {
    "plugins": [
      "exec_orch",
      "design_ppt"
    ],
    "mcp": [],
    "env": []
  },
  "entry_points": {
    "default_command": "pdf-generate",
    "core_skills": [
      "skill-pdf-design-system",
      "skill-pdf-form",
      "skill-pdf-compliance"
    ]
  },
  "metadata": {
    "category": "디자인/PDF",
    "tags": [
      "design"
    ],
    "author": "bernakilljos",
    "created": "2026-04-19",
    "updated": "2026-04-30",
    "precedence": 10,
    "token_estimate": 2400,
    "triggers": [
      "PDF 생성",
      "양식 채우기",
      "전자서명",
      "암호화"
    ]
  }
}
