{
  "$schema": "../../.claude-plugin/plugin-schema.json",
  "name": "design_video",
  "display": "영상 편집 — 자막·쇼츠·썸네일 (유튜브 수익화 직결)",
  "prefix": "design_",
  "version": "1.0",
  "status": "stable",
  "phase": 2,
  "commands": "commands/",
  "skills": "skills/",
  "dependencies": {
    "plugins": [
      "exec_orch",
      "mcp_media"
    ],
    "mcp": [],
    "env": []
  },
  "entry_points": {
    "default_command": "video-edit",
    "core_skills": [
      "skill-video-remotion",
      "skill-video-retention"
    ]
  },
  "metadata": {
    "category": "디자인/Video",
    "tags": [
      "design"
    ],
    "author": "bernakilljos",
    "created": "2026-04-19",
    "updated": "2026-04-19",
    "precedence": 10,
    "token_estimate": 2000,
    "triggers": [
      "영상 편집",
      "자막",
      "쇼츠",
      "유튜브 썸네일"
    ]
  }
}