{
  "$schema": "../../.claude-plugin/plugin-schema.json",
  "name": "review_qa",
  "display": "코드 리뷰·보안 검사·품질 검증·테스트 자동화",
  "prefix": "review_",
  "version": "1.0",
  "status": "stable",
  "phase": 0,
  "commands": "commands/",
  "skills": "skills/",
  "agents": "agents/",
  "hooks": "hooks/",
  "dependencies": {
    "plugins": [
      "exec_orch"
    ],
    "mcp": [],
    "env": []
  },
  "entry_points": {
    "default_command": "check",
    "core_skills": [
      "skill-03-review",
      "skill-06-test",
      "skill-10-quality-verify"
    ]
  },
  "metadata": {
    "category": "검증/QA",
    "tags": [
      "review"
    ],
    "author": "bernakilljos",
    "created": "2026-04-10",
    "updated": "2026-04-19",
    "precedence": 5,
    "token_estimate": 5200,
    "triggers": [
      "코드 리뷰",
      "보안",
      "품질",
      "테스트",
      "OWASP"
    ]
  }
}
